file_name,uni,wylie,url,dept,grade,char_len,audio_len,path,inf
STT_PC0023_0111_871893_to_879701,སྐུ་ཚབ་དོན་གཅོད་ཁང་དབུ་འབྱེད་གནང་གི་ཡིན་སེ། ག་རེ་ཟེར་ན་ད་ང་ཚོ་སྔན་ལ་ཁང་པ་གྲ་སྒྲིག་བྱེད་དགོས་རེད། དེའི་ནང་བཟོ་བཅོས་བརྒྱབ་དགོས་རེད། ཨེ་ནས་ལས་ཤག་གཏན་འཁེལ་བྱེད་དགོས་རེད། ལས་ཀ་མང་པོ་ཞིག་ཡོད་རེད་བ།  ,sku tshab don gcod khang dbu 'byed gnang gi yin se/_ga re zer na da nga tsho sngan la khang pa gra sgrig byed dgos red/_de'i nang bzo bcos brgyab dgos red/_e nas las shag gtan 'khel byed dgos red/_las ka mang po zhig yod red ba/__,https://d38pmlk0v88drf.cloudfront.net/wav16k/STT_PC0023_0111_871893_to_879701.wav,STT_PC,3,193,7.808,wav16k/STT_PC0023_0111_871893_to_879701.wav,སྐུ་ཚབ་དོན་གཅོད་པང་དབུ་འབྱེད་གནང་གི་ཡིན་ཟེ། ག་རེད་ཟེར་ན། ད་ང་ཚོ་སྔན་ལ་ཡ་ཁང་པ་གྲ་སྒྲིག་བྱེད་དགོས་རེད། དེའི་ནང་བཟོ་བཅོས་རྒྱག་དགོས་རེད། ཨེ་ནས་ལས་ཤག་གཏན་འཁེལ་བྱེད་དགོས་རེད། ལས་ཀ་མང་པོ་ཞིག་ཡོད་རེད་བ།
STT_TT00764_0112_707227_to_710427,ཆོ་ག་ལ་བརྟེན་ནས་ཐོབ་པའི་སྔགས་སྡོམ་ཡིན་པའི་ཕྱིར་ཏེ། དེ་ནས་ ,cho ga la brten nas thob pa'i sngags sdom yin pa'i phyir te/_de nas _,https://d38pmlk0v88drf.cloudfront.net/wav16k/STT_TT00764_0112_707227_to_710427.wav,STT_TT,3,58,3.2,wav16k/STT_TT00764_0112_707227_to_710427.wav,ཆོ་ག་ལ་བརྟེན་ནས་ཐོབ་པའི་སྔགས་སྡོམ་ཡིན་པའི་ཕྱིར་ཏེ། དེ་ནས།
STT_PC0090_0050_402389_to_405365,དེ་མནན་པ་ད་ག་ཤར་རྒྱག་ཡིན་ན་སོ་སོ་ས་གནས་ག་བར་བསྡད་ཡོད་པ་ཡིན་ན་ལས་ ,de mnan pa da ga shar rgyag yin na so so sa gnas ga bar bsdad yod pa yin na las _,https://d38pmlk0v88drf.cloudfront.net/wav16k/STT_PC0090_0050_402389_to_405365.wav,STT_PC,3,65,2.976,wav16k/STT_PC0090_0050_402389_to_405365.wav,འདི་གླེན་པ་ད་ག་ཤར་རྒྱག་ཡིན་ན། སོ་སོ་ས་གནས་ག་བར་བསྡད་ཡོད་པ་ཡིན་ན་ལས།
STT_PC0090_0052_414165_to_417173,ད་དེའི་ནང་ནས་བརྒྱ་ཆ་ཀླད་ཀོར་ཚག ཀླད་ཀོར་ཀླད་ཀོར་ཀླད་ཀོར་གཅིག་གི་ ,da de'i nang nas brgya cha klad kor tshag_klad kor klad kor klad kor gcig gi _,https://d38pmlk0v88drf.cloudfront.net/wav16k/STT_PC0090_0052_414165_to_417173.wav,STT_PC,3,64,3.008,wav16k/STT_PC0090_0052_414165_to_417173.wav,ད་དིའི་ནང་ནས་བརྒྱ་ཆ་ཀླད་ཀོར་ཚག། ཀླད་ཀོར་ཀླད་ཀོར་ཀླད་ཀོར་གཅིག་གིས་
STT_MV0944_0250_1869581_to_1874665,གལ་སྲིད་ངའི་པཱ་ལགས་ཀིས་ཐའེ་ཡན་ལ་བྱ་སྤྱོད་ཏོག་ཙི་སྤེལ་ན། ང་ཚོ་བཟུང་བྱས་བཙོན་ཁང་ལ་བཅུག་གི་རེད།  ,gal srid nga'i pA lags kis tha'e yan la bya spyod tog tsi spel na/_nga tsho bzung byas btson khang la bcug gi red/__,https://d38pmlk0v88drf.cloudfront.net/wav16k/STT_MV0944_0250_1869581_to_1874665.wav,STT_MV,3,94,5.084,wav16k/STT_MV0944_0250_1869581_to_1874665.wav,གལ་སྲིད་ངའི་པཱ་ལགས་ཀིས་ཐའེ་ཡན་ལ་ཡ་བྱ་སྤྱོད་ཏོག་ཙི་སྤེལ་ན། ང་ཚོ་བཟིམ་བྱས་བཙོན་ཁང་ལ་བཅུག་དགོས་རེད།
STT_PC0090_0054_430389_to_433109,ཨེ་ནས་མི་མང་པོ་ཞེ་བོ་ཅིག་གིས་ཁ་པར་བཏང་བྱས། གྲོས་ཚོགས་འཐུས་མི་དེ་ཚོ།  ,e nas mi mang po zhe bo cig gis kha par btang byas/_gros tshogs 'thus mi de tsho/__,https://d38pmlk0v88drf.cloudfront.net/wav16k/STT_PC0090_0054_430389_to_433109.wav,STT_PC,3,69,2.72,wav16k/STT_PC0090_0054_430389_to_433109.wav,ཨེ་ནས་མི་མང་པོ་ཞེ་བོ་ཅིག་གིས་ཁ་པར་བཏང་བྱས་ གྲོས་ཚོགས་འཐུས་མི་དེ་ཚོས།
STT_MV0944_0252_1876294_to_1885690,འདུག་སེ་བྱས་པ་ཡིན་ན། ད་ལྟ་ང་ཚོའི་གནས་བབ་འདི་དངོས་གནས་ཉེན་ཁ་ཆེན་པོ་མ་རེད། གནས་ཚུལ་ལ་འགྱུར་ལྡོག་མེད་ན། གནས་སྐབས་ཉེན་ཁ་ཡོད་མ་རེད།  ,'dug se byas pa yin na/_da lta nga tsho'i gnas bab 'di dngos gnas nyen kha chen po ma red/_gnas tshul la 'gyur ldog med na/_gnas skabs nyen kha yod ma red/__,https://d38pmlk0v88drf.cloudfront.net/wav16k/STT_MV0944_0252_1876294_to_1885690.wav,STT_MV,3,128,9.396,wav16k/STT_MV0944_0252_1876294_to_1885690.wav,འདུག་སེ་བྱས་པ་ཡིན་ན། ད་ལྟ་ང་ཚོའི་གནས་བབས་འདི་དངོས་གནས་ཉེན་ཁ་ཆེན་པོ་མ་རེད་པེ། གནས་ཚུལ་ལ་ཡ་འགྱུར་ལྡོག་མེད་ན་གནས་སྐབས་ཉེན་ཁ་ཡོད་མ་རེད།
STT_TT00767_0129_794085_to_796517,ཞེས་ཞེས་པ་དེ་འབྱུང་བ་ཡིན་པའི་ཕྱིར་ཟེར་གོ་རེད།  ,zhes zhes pa de 'byung ba yin pa'i phyir zer go red/__,https://d38pmlk0v88drf.cloudfront.net/wav16k/STT_TT00767_0129_794085_to_796517.wav,STT_TT,3,47,2.432,wav16k/STT_TT00767_0129_794085_to_796517.wav,ཞེས་ཞེས་པ་དེ་འབྱུང་བ་ཡིན་པའི་ཕྱིར་ཟེར་གོ་རེད།
STT_PC0023_0109_860277_to_863189,ཆིབས་བསྒྱུར་གནང་ཐུབ་པ་ཡིན་ན་དབུ་འབྱེད་མཛད་སྒོ་ལ་ཆིབས་བསྒྱུར་གནང་ཐུབ་ན་ཡག་པོ་འདུག་ཟེ་ ,chibs bsgyur gnang thub pa yin na dbu 'byed mdzad sgo la chibs bsgyur gnang thub na yag po 'dug ze _,https://d38pmlk0v88drf.cloudfront.net/wav16k/STT_PC0023_0109_860277_to_863189.wav,STT_PC,3,85,2.912,wav16k/STT_PC0023_0109_860277_to_863189.wav,ཆིབས་བསྒྱུར་གནང་ཐུབ་པ་ཡིན་ན། དབུ་འབྱེད་མཛད་སྒོ་ལ་ཆིབས་བསྒྱུར་གནང་ཐུབ་ན་ཡག་པོ་འདུག་ཟེ།
STT_MV0944_0255_1898970_to_1908969,ཧེན གཡོག་པོ་ཁྱིའི་ཟོལ་ར་དེ་ཚོ། ངེད་གཉིས་ག་བར་བརྩི་གི་ཡོད་རེད། བཙོན་པ་ནང་བཞིན་རེད་ཤག།  ,hen_g.yog po khyi'i zol ra de tsho/_nged gnyis ga bar brtsi gi yod red/_btson pa nang bzhin red shag/__,https://d38pmlk0v88drf.cloudfront.net/wav16k/STT_MV0944_0255_1898970_to_1908969.wav,STT_MV,3,86,9.999,wav16k/STT_MV0944_0255_1898970_to_1908969.wav,ཧེན། གཡོག་པོ་ཁྱིའི་ཟོལ་ར་དེ་ཚོ། ངེད་གཉིས་ག་པར་བརྩི་གི་ཡོད་རེད། བཙོན་པོ་ནང་བཞིན་རེད་ཤག ཨོ།
STT_PC0023_0113_889301_to_891605,མཛད་སྒོ་ཚོགས། ཨེ་ནས་མཛད་སྒོའི་སྐུ་མགྲོན་གཙོ་བོ་ལ་ཡ།  ,mdzad sgo tshogs/_e nas mdzad sgo'i sku mgron gtso bo la ya/__,https://d38pmlk0v88drf.cloudfront.net/wav16k/STT_PC0023_0113_889301_to_891605.wav,STT_PC,3,53,2.304,wav16k/STT_PC0023_0113_889301_to_891605.wav,མཛད་སྒོ་ཚོགས། ཨེ་ནས་མཛད་སྒོའི་སྐུ་མགྲོན་གཙོ་བོ་ལ་ཡ་
STT_PC0111_0130_1006472_to_1008616,ཁོས་ངའི་ལོ་རྒྱུས་དང་ཨེ་འདྲ་ཤེས་ཀི་མེད། ཧ་གོ་གི་མེད་ཟེར་གི་འདུག་ ,khos nga'i lo rgyus dang e 'dra shes ki med/_ha go gi med zer gi 'dug _,https://d38pmlk0v88drf.cloudfront.net/wav16k/STT_PC0111_0130_1006472_to_1008616.wav,STT_PC,3,64,2.144,wav16k/STT_PC0111_0130_1006472_to_1008616.wav,ཁོས་ངས་ལོ་རྒྱུས་དང་ཨེ་འདྲས་ཤེས་ཀི་མེད། ཧ་གོ་གི་མེད་ཟེར་གི་འདུག
STT_PC0023_0103_819509_to_822197,ཨ་བཀའ་ཟུར་སྟག་ལྷ་ཕུན་ཚོགས་བཀྲ་ཤིས་ཡོད་རེད། ང་ཡོད་རེད། ང་ཚོ་གསུམ་ ,a bka' zur stag lha phun tshogs bkra shis yod red/_nga yod red/_nga tsho gsum _,https://d38pmlk0v88drf.cloudfront.net/wav16k/STT_PC0023_0103_819509_to_822197.wav,STT_PC,3,65,2.688,wav16k/STT_PC0023_0103_819509_to_822197.wav,ཨ། བཀའ་ཟུར་སྟག་ལོ་ཕུན་ཚོགས་བཀྲ་ཤིས་ཡོད་རེད། ང་ཡོད་རེད། ང་ཚོ་གསུམ་
STT_PC0023_0100_806037_to_808405,ད་ལྟ་ཐེ་ཝན་གི་པཱ་དྷ་ལོས་ཟེར་སའི་ས་ཆ་དེ་ལ་ཡ།  ,da lta the wan gi pA d+ha los zer sa'i sa cha de la ya/__,https://d38pmlk0v88drf.cloudfront.net/wav16k/STT_PC0023_0100_806037_to_808405.wav,STT_PC,3,45,2.368,wav16k/STT_PC0023_0100_806037_to_808405.wav,ད་ལྟ་ཐེ་ཝན་གི་པ་དྷ་ལུ་ཟེར་ས་ཆ་འདི་ལ་ཡ་
STT_MV0756_0187_1338733_to_1345468,ཇེན་ཇེན། རང་འདིར་ལས་ཀ་བྱེད་འདོད་ཡོད་མེད། ལས་ཀ་ལས་ཀ་ཡིན་ཟེ་ཡག་པོ་མ་བྱས་བྱས། ད་དུང་རྟག་པར་ཕྱི་འབྱོར་ལས།  ,jen jen/_rang 'dir las ka byed 'dod yod med/_las ka las ka yin ze yag po ma byas byas/_da dung rtag par phyi 'byor las/__,https://d38pmlk0v88drf.cloudfront.net/wav16k/STT_MV0756_0187_1338733_to_1345468.wav,STT_MV,3,103,6.735,wav16k/STT_MV0756_0187_1338733_to_1345468.wav,ཇེན་ཇེན། རང་འདིར་ལས་ཀ་བྱེད་འདོད་ཡོད་མེད། ལས་ཀ་ལས་ཀ་ཡིན་ཟེ་ཡག་པོ་མ་བྱས་པ་བྱས། ད་དུང་རྟག་པར་ཕྱིན་འབྱོར་ལེད།
STT_TT00734_0139_845641_to_850217,དུག་དེ་དང་མ་འཕྲད་པ་གི་ཐབས་ཤེས་གང་དྲག་བྱེད་ཀི་ཡོད་རེད་བ། དེ་དང་འདྲ་བ་སྔར་བྱས་ཀྱི་སྡིག་པ་དེ་གིས་ ,dug de dang ma 'phrad pa gi thabs shes gang drag byed ki yod red ba/_de dang 'dra ba sngar byas kyi sdig pa de gis _,https://d38pmlk0v88drf.cloudfront.net/wav16k/STT_TT00734_0139_845641_to_850217.wav,STT_TT,3,95,4.576,wav16k/STT_TT00734_0139_845641_to_850217.wav,དུག་དེ་དང་མ་འཕྲད་པ་གི་ཐབས་ཤེས་ག་འདྲ་བྱེད་ཀི་ཡོད་རེད་བ། དེ་དང་འདྲ་བ་སྔར་བྱས་ཀྱི་སྡིག་པ་དེ་གིས་
STT_PC0090_0055_437749_to_439829,དེ་འདྲ་སོང་ཙང་། དེ་གྲོས་འཆར་དེ་ལ་ཡ་ཡིན་ན་རྒྱབ་སྐྱོར།  ,de 'dra song tsang /_de gros 'char de la ya yin na rgyab skyor/__,https://d38pmlk0v88drf.cloudfront.net/wav16k/STT_PC0090_0055_437749_to_439829.wav,STT_PC,3,54,2.08,wav16k/STT_PC0090_0055_437749_to_439829.wav,དེ་འདྲས་སོང་ཙང་། དི་གྲོས་འཆར་དེ་ལ་ཡ་ཡིན་ན་རྒྱབ་སྐྱོར།
STT_MV0944_0256_1908969_to_1917032,ཞའོ་ལིས། ཤོས་ཉིད་ཅང་ཏུང་ལ་ག་འདྲས་སེ་བསླེབས་པ་རེད། དེ་དངོས་གནས་ཡག་ཐག་མ་བྱུང་བ། ཤོས་ཉིད་ཉེན་ཁ་ཡོད་པའི་མ་ཚད། སྲས་སུང་ལགས་ཀིས་རྒྱལ་པོས་ཁ་གཏད་བཅག་རྩིས་ཡོད་པར་ཧ་གོ་གི་མ་རེད།  ,zha'o lis/_shos nyid cang tung la ga 'dras se bslebs pa red/_de dngos gnas yag thag ma byung ba/_shos nyid nyen kha yod pa'i ma tshad/_sras sung lags kis rgyal pos kha gtad bcag rtsis yod par ha go gi ma red/__,https://d38pmlk0v88drf.cloudfront.net/wav16k/STT_MV0944_0256_1908969_to_1917032.wav,STT_MV,3,169,8.063,wav16k/STT_MV0944_0256_1908969_to_1917032.wav,ཞའོ་ལིས། ཤོས་ཉིད་ཅང་ཏུང་ལ་ག་འདྲས་སེ་སླེབས་པ་རེད། དེ་དངོས་གནས་ཡག་རྟག་མ་བྱུང་ང་། ཤོས་ཉིད་ཉེན་ཁ་ཡོད་པ་མ་ཚད། སྲས་སུང་ལགས་ཀིས་རྒྱལ་པོས་ཁ་གཏད་བཅག་རྩིས་ཡོད་པ་ཧ་གོ་གི་མ་རེད།
STT_NS_M0482_0236_1635962_to_1639305,མི་གདོང་མདུན་ལ་བརྒྱབ་ན་ཨེ་ནས་ནད་འབུ་ཚང་མ་མི་གཞན་པ་ལ་ཡང་ཁྱབ་སྲིད་བ་རཱ།  ,mi gdong mdun la brgyab na e nas nad 'bu tshang ma mi gzhan pa la yang khyab srid ba rA/__,https://d38pmlk0v88drf.cloudfront.net/wav16k/STT_NS_M0482_0236_1635962_to_1639305.wav,STT_NS,3,71,3.343,wav16k/STT_NS_M0482_0236_1635962_to_1639305.wav,མི་གདོང་མདུན་ལ་བརྒྱབ་ན་ཨེ་ནས་ནད་འབུ་ཚང་མ་མི་གཞན་པ་ལ་ཡང་ཁྱབ་སྲིད་བ་རཱ།
STT_PC0090_0056_462293_to_464885,ད་ཨ་མེ་རི་ཀའི་ཆབ་སྲིད་ལ་ཡ་གཡོ་འགུལ་གཏང་ཡ་གི་ནུས་པ་འདི་ག་ཙི་འདུག ,da a me ri ka'i chab srid la ya g.yo 'gul gtang ya gi nus pa 'di ga tsi 'dug_,https://d38pmlk0v88drf.cloudfront.net/wav16k/STT_PC0090_0056_462293_to_464885.wav,STT_PC,3,64,2.592,wav16k/STT_PC0090_0056_462293_to_464885.wav,ད་ཨ་མི་རི་ཀའི་ཆབ་སྲིད་ལ་ཡ་གཡོ་འགུལ་བཏང་ཡ་གི་ནུས་པ་དེ་ག་ཙི་འདུག
STT_TT00755_0072_382478_to_389155,འཁོར་བའི་རྒྱུ་ལས་ཉོན་ལས་གྲོལ་ཟིན་པའི་གི་དེ་འདྲའི་གི་སྐྱབས་ཅིག་ལ་སྐྱབས་མ་ཞུས་ན། རང་དང་འདྲ་བ་གི་ལས་ཉོན་གི་ནང་ལ་བསྡད་བསྡད་མྱི།  ,'khor ba'i rgyu las nyon las grol zin pa'i gi de 'dra'i gi skyabs cig la skyabs ma zhus na/_rang dang 'dra ba gi las nyon gi nang la bsdad bsdad myi/__,https://d38pmlk0v88drf.cloudfront.net/wav16k/STT_TT00755_0072_382478_to_389155.wav,STT_TT,3,125,6.677,wav16k/STT_TT00755_0072_382478_to_389155.wav,འཁོར་བའི་རྒྱུ་ལས་ཉོན་ལས་གྲོལ་ཟིན་པའི་གི་དེ་འདྲའ་གི་སྐྱབས་ཅིག་ལ་སྐྱབས་མ་ཞུ་ན། རང་དང་འདྲ་བའི་གི་ལས་ཉོན་གི་ནང་ལ་བསྡད་བསྡད་ངེ།
STT_TT00760_0894_5512551_to_5517977,བྱང་ཆུབ་གསུམ་པོ་གང་ཡང་ཐོབ་ཐུབ་ཀི་མ་རེད་ཟེར་གོ་རེད། ཨེ་ནས་ཐལ་འགྱུར་པ་གིས་དེ་ནས།  ,byang chub gsum po gang yang thob thub ki ma red zer go red/_e nas thal 'gyur pa gis de nas/__,https://d38pmlk0v88drf.cloudfront.net/wav16k/STT_TT00760_0894_5512551_to_5517977.wav,STT_TT,3,80,5.426,wav16k/STT_TT00760_0894_5512551_to_5517977.wav,བྱང་ཆུབ་གསུམ་པོ་གང་ཡང་ཐོབ་ཐུབ་ཀི་མ་རེད་ཟེར་གོ་རེད། ཨེ་ནས། ཐལ་འགྱུར་པ་གིས་དེ་ནས།
STT_TT00702_0054_319325_to_327875,ཨོ་དེ་འདྲས་ཡིན་དུས། དེའི་རྒྱུ་མཚན་དེ་ད། འདིའི་རྩ་བ་འདི་འདྲས་འདྲ་བོ་ཅིག་ལ་འདི། རྟགས་ཐོན་ངེས་པ་ཅིག་དགོས་ཟེ་བའི་སྐབས་སུ་ལ། སེམས་ལ་ཡ་དངོས་གནས་དལ་འབྱོར་རྙེད་དཀའ་བ་ཟེ་ཡ་དེ། ཁ་ནས་བཤད་བསྡད་པ་གཅིག་པོ་མ་ཡིན་པ།  ,o de 'dras yin dus/_de'i rgyu mtshan de da/_'di'i rtsa ba 'di 'dras 'dra bo cig la 'di/_rtags thon nges pa cig dgos ze ba'i skabs su la/_sems la ya dngos gnas dal 'byor rnyed dka' ba ze ya de/_kha nas bshad bsdad pa gcig po ma yin pa/__,https://d38pmlk0v88drf.cloudfront.net/wav16k/STT_TT00702_0054_319325_to_327875.wav,STT_TT,3,201,8.55,wav16k/STT_TT00702_0054_319325_to_327875.wav,ཨོ་དེ་འདྲའི་ཡིན་དུས། དེའི་རྒྱུ་མཚན་དེ་ད་ འདིའི་རྩ་བ་འདི་འགྲོ་ཅིག་ལ། ་འདི། རྟགས་ཐོན་ངེས་པ་ཅིག་དགོས་ཟེར་བའི་སྐབས་སུ་ལ། སེམས་ལ་ཡ། དངོས་གནས་དལ་འབྱོར་རྙེད་དཀའ་བ་ཟེར་དེ། ཁ་ནས་བཤད་བསྡད་པ་གཅིག་པ་མ་ཡིན་པ།
STT_PC0090_0058_491029_to_493429,ཁྲིམས་གཞི་དེ་གྲོས་ཚོགས་འོག་མའི་ནང་ལོགས་ཡ་མང་མོས་བྱུང་འདུག ,khrims gzhi de gros tshogs 'og ma'i nang logs ya mang mos byung 'dug_,https://d38pmlk0v88drf.cloudfront.net/wav16k/STT_PC0090_0058_491029_to_493429.wav,STT_PC,3,58,2.4,wav16k/STT_PC0090_0058_491029_to_493429.wav,ཁྲིམས་གཞི་འདི་གྲོས་ཚོགས་འོག་མའི་ནང་ལོགས་ལ་ཡ་དམང་མོས་བྱུང་ཐུབ་།
STT_TT00751_0248_1405888_to_1409152,ཨོ་དེ་ཡིན་དུས། དེ་འདྲའི་མ་ལུས་པ་ཅིག་གི་ད། ཐབས་ཤེས་བྱེད་ཡ་དེ་གལ་ཆེན་པོ་རེད།  ,o de yin dus/_de 'dra'i ma lus pa cig gi da/_thabs shes byed ya de gal chen po red/__,https://d38pmlk0v88drf.cloudfront.net/wav16k/STT_TT00751_0248_1405888_to_1409152.wav,STT_TT,3,76,3.264,wav16k/STT_TT00751_0248_1405888_to_1409152.wav,ཨོ་དེ་ཡིན་དུས། དེ་འདྲའི་མ་ལུགས་པ་ཅིག་གི ད་ཐབས་ཤེས་བྱེད་ཡ་དེ་གལ་ཆེན་པོ་རེད།
STT_MV0705_0149_1323821_to_1328656,ཡིན་ནས་རང་གིས་ལའོ་ཤེ་གི་གཟུགས་པོའི་གནས་ཚུལ་ལ་བསམ་བློ་གཏང་དགོས་རེད་ད་ ,yin nas rang gis la'o she gi gzugs po'i gnas tshul la bsam blo gtang dgos red da _,https://d38pmlk0v88drf.cloudfront.net/wav16k/STT_MV0705_0149_1323821_to_1328656.wav,STT_MV,3,69,4.835,wav16k/STT_MV0705_0149_1323821_to_1328656.wav,ཡིན་ནས་རང་གིས་ལའོ་ཤེ་ཀི་གཟུགས་པོའི་གནས་ཚུལ་ལ་བསམ་བློ་གཏང་དགོས་རེད་དང།
STT_PC0090_0059_508405_to_512821,དེ་བ་ཕར་སྤྱིར་བཏང་གི་སྤྱི་ཚོགས་དྲ་ལམ་དང་། གསར་འགྱུར་བརྒྱུད་ལམ་ཁག་ལ་བལྟས་ཡོང་དུས། རྒྱུ་མཚན་མང་པོ་ཞེ་བོ་ཅིག་ལབ་ཀི་འདུག ,de ba phar spyir btang gi spyi tshogs dra lam dang /_gsar 'gyur brgyud lam khag la bltas yong dus/_rgyu mtshan mang po zhe bo cig lab ki 'dug_,https://d38pmlk0v88drf.cloudfront.net/wav16k/STT_PC0090_0059_508405_to_512821.wav,STT_PC,3,117,4.416,wav16k/STT_PC0090_0059_508405_to_512821.wav,དེ་བ་ཕར་སྤྱིར་བཏང་གི་སྤྱི་ཚོགས་དྲྭ་ལམ་དང་ གསར་འགྱུར་བརྒྱུད་ལམ་སྒང་ལ་བལྟས་ད། རྒྱུ་མཚན་མང་པོ་ཞེ་བོ་ཅིག་ལབ་ཀི་འདུག
STT_PC0090_0060_513173_to_516469,ཁྲིག་ཀྲོག་གི་ནང་དོན་ཁ་ཤས་ཡག་པོ་མི་འདུག་དེ་བ་ཕར་ཨེ་འདྲ་ཟེར་མྱི་མང་པོ་ཡོད་རེད་དེ་ལས་ཡིན་ནས་ ,khrig krog gi nang don kha shas yag po mi 'dug de ba phar e 'dra zer myi mang po yod red de las yin nas _,https://d38pmlk0v88drf.cloudfront.net/wav16k/STT_PC0090_0060_513173_to_516469.wav,STT_PC,3,90,3.296,wav16k/STT_PC0090_0060_513173_to_516469.wav,ཁྲིག་ཀྲོག་ཀི་ནང་དོན་ཁ་ཤས་ཡག་པོ་མི་འདུག འདི་བ་ཕར་ཨེ་འདྲས་ཟེར་མྱི་མང་པོ་ཡོད་རེད་དེ་ལས། ཡིན་ནས།
STT_TT00761_0678_4192107_to_4200605,མདོར་ན་སེམས་ཅན་གི་རྒྱུད་ལ་འབྲས་དུས་ཀི་ཆོས་སྐུ་ངོ་མ་ཡོད་ཟེར་གོ་རེད། ད་ལྟ་ང་ཚོའི་སེམས། ད་ལྟ་ང་ཚོའི་སེམས་ཀྱི་ཐོག་ལ།  ,mdor na sems can gi rgyud la 'bras dus ki chos sku ngo ma yod zer go red/_da lta nga tsho'i sems/_da lta nga tsho'i sems kyi thog la/__,https://d38pmlk0v88drf.cloudfront.net/wav16k/STT_TT00761_0678_4192107_to_4200605.wav,STT_TT,3,114,8.498,wav16k/STT_TT00761_0678_4192107_to_4200605.wav,མདོར་ན། སེམས་ཅན་གི་རྒྱུད་ལ་འབྲས་དུས་ཀི་ཆོས་སྐུ་ངོ་མ་ཡོད་ཟེར་གོ་རེད། ད་ལྟ་ང་ཚོའི་སེམས། ད་ལྟ་ང་ཚོའི་སེམས་ཀི་ཐོག་ལ།
STT_PC0090_0061_516757_to_520117,དངོས་གནས་རང་ཁོ་ཕར་ཁྲིམས་གཞིའི་ནང་ལོགས་ལ་མཐའ་མ་དེར་ཡ་ད་རྒྱུ་མཚན་ཞིག་བགྲང་དགོས་རེད་བ་ ,dngos gnas rang kho phar khrims gzhi'i nang logs la mtha' ma der ya da rgyu mtshan zhig bgrang dgos red ba _,https://d38pmlk0v88drf.cloudfront.net/wav16k/STT_PC0090_0061_516757_to_520117.wav,STT_PC,3,84,3.36,wav16k/STT_PC0090_0061_516757_to_520117.wav,དངོས་གནས་རང་ཁོ་ཕར་ཁྲིམས་གཞིའི་ནང་ལོགས་ལ་མཐའ་མ་དེ་ཡ་ད་རྒྱུ་མཚན་ར་ཅིག་བགྲང་དགོས་རེད་བ།
STT_TT00766_0304_1761611_to_1765291,རབ་དབྱེ་སྐབས་གཉིས་པའི་དངོས་བསྟན་གྱི་ཐེག་པ་ཆེན་པོའི་སེམས་བསྐྱེད་རེད་བསྡད་ཡོད་རེད། ད་ལྟ་འདིའི་ ,rab dbye skabs gnyis pa'i dngos bstan gyi theg pa chen po'i sems bskyed red bsdad yod red/_da lta 'di'i _,https://d38pmlk0v88drf.cloudfront.net/wav16k/STT_TT00766_0304_1761611_to_1765291.wav,STT_TT,3,93,3.68,wav16k/STT_TT00766_0304_1761611_to_1765291.wav,རབ་དབྱེ་སྐབས་གཉིས་པའི་དངོས་བསྟན་གྱི་ཐེག་པ་ཆེན་པོའི་སེམས་བསྐྱེད་རེད་བསྡད་ཡོད་རེད། ད་ལྟ་དེ།
