file_name,uni,wylie,url,dept,grade,char_len,audio_len,path,inf
STT_PC0135_0046_291154_to_297252,བུ་གུ་ཕ་མ་རང་ཉིད་ཀིས་ཅིག་གསོ་སྐྱོང་གནང་ཡ་དང་། ཨ་ད་འདི་ཕན་ཐོགས་ར་ཅིག་ག་ཚད་ཡོད།  ,bu gu pha ma rang nyid kis cig gso skyong gnang ya dang /_a da 'di phan thogs ra cig ga tshad yod/__,https://d38pmlk0v88drf.cloudfront.net/wav16k/STT_PC0135_0046_291154_to_297252.wav,STT_PC,3,79,6.098,wav16k/STT_PC0135_0046_291154_to_297252.wav,བུ་གུ་ཕ་མ་རང་ཉིད་ཀིས་ཅིག་གསོ་སྐྱོང་གནང་ཡ་དང་། ཨ་ད་དེ་ཕན་ཐོགས་ར་ཅིག་ག་ཚད་ཡོད།
STT_MV0758_0037_231784_to_234835,སྲུའུ་ཀྲན།  ,sru'u kran/__,https://d38pmlk0v88drf.cloudfront.net/wav16k/STT_MV0758_0037_231784_to_234835.wav,STT_MV,3,12,3.051,wav16k/STT_MV0758_0037_231784_to_234835.wav,སྲུའུ་ཌན།
STT_NS_M0452_0163_961429_to_963833,ང་ཚོ་རྒྱལ་པོ་འདྲ་བོ་ཡིན་ན་ཁ་སེང་སྔོན་མ་འདྲ་བོ་ཡིན་ན།  ,nga tsho rgyal po 'dra bo yin na kha seng sngon ma 'dra bo yin na/__,https://d38pmlk0v88drf.cloudfront.net/wav16k/STT_NS_M0452_0163_961429_to_963833.wav,STT_NS,3,54,2.404,wav16k/STT_NS_M0452_0163_961429_to_963833.wav,ང་ཚོ་རྒྱལ་པོ་འདྲ་བོ་ཡིན་ན་ཁ་སང་སྔོན་མ་འདྲ་བོ་ཡིན་ན།
STT_MV0756_0165_1147241_to_1151417,རང་གིས་ཨ་ཅག་སྐད་བཏང་གར་ཕྱིན་བྱས། ཨ་མ་འགྲོ་མྱི་རེད་ཤག་ཟེ་ལབ། ཨ་ཅག་ཕྱི་ལ་ཕྱིན་སོང་།  ,rang gis a cag skad btang gar phyin byas/_a ma 'gro myi red shag ze lab/_a cag phyi la phyin song /__,https://d38pmlk0v88drf.cloudfront.net/wav16k/STT_MV0756_0165_1147241_to_1151417.wav,STT_MV,3,83,4.176,wav16k/STT_MV0756_0165_1147241_to_1151417.wav,རང་གིས་ཨ་ཅག་སྐད་གཏང་གར་ཕྱིན་བྱས། ཨ་མ་འགྲོ་མྱི་རེད་ཤག་ཟེ་ལོབ། ཨ་ཅག་ཕྱི་ལ་ཕྱིན་སོང་།
STT_PC0135_0047_315349_to_324453,ད་བུ་གུ་ཨོ་སོ་སོའི་ལྟ་ཡ་འདིའི་ཐོག་ནས་ཞུས་པ་ཡིན་ན་ང་ནང་ཚོའི་ཨ་ཕ་མ་མང་པོ་ཅིག་གིས་ག་རེ་དགོངས་གནང་གི་རེད་ཟེར་ན། ཨ་ཨ་ཙི་སུ་དང་སུ་ཡིན་ནས་ལས།  ,da bu gu o so so'i lta ya 'di'i thog nas zhus pa yin na nga nang tsho'i a pha ma mang po cig gis ga re dgongs gnang gi red zer na/_a a tsi su dang su yin nas las/__,https://d38pmlk0v88drf.cloudfront.net/wav16k/STT_PC0135_0047_315349_to_324453.wav,STT_PC,3,136,9.104,wav16k/STT_PC0135_0047_315349_to_324453.wav,ད་བུ་གུ་ཨོ་སོ་སོས་ལྟ་ཡ་དེའི་ཐོག་ནས་ཞུས་པ་ཡིན་ན། ང་རང་ཚོས་ཨོ་ཕ་མ་མང་པོ་ཅིག་གིས་ག་རེ་སྒོམ་གནང་གི་རེད་ཟེར་ན། ཨ་ཨ་ཙི་སུ་དང་སུ་ཡིན་ན་ལས།
STT_CS-D-2015-M-D-B01-3-R-05_0065_449138_to_454957,ང་ཚོ་འཛིན་གྲྭ་ཡ་ཡུད་སྙིང་རྗེ་བོ་ཡོད་རེད་ད། ཐྲྀ་སུམ་པ་གདུགས་ཡ་ཡུད་སྡུག་ཅག་ཡོད་རེད་ད་རཱ། ཨ་ནས་རཱ།  ,nga tsho 'dzin grwa ya yud snying rje bo yod red da/_thr-i sum pa gdugs ya yud sdug cag yod red da rA/_a nas rA/__,https://d38pmlk0v88drf.cloudfront.net/wav16k/STT_CS-D-2015-M-D-B01-3-R-05_0065_449138_to_454957.wav,STT_CS,3,97,5.819,wav16k/STT_CS-D-2015-M-D-B01-3-R-05_0065_449138_to_454957.wav,ང་ཚོ་འཛིན་གྲྭ་ཡ་ཡུད་སྙིང་རྗེ་བོ་ཡོད་རེད་ད། ཁྲི་གསུམ་པ་གདུག་ཡ་ཡུད་སྡུག་ཅག་ཡོད་རེད་ད་རཱ། ཨ་ནས་རཱ།
STT_NS_M0421_0105_1502691_to_1504909,དྲི་བ་དྲི་དགོས་མ་རེད་བསམ་གི་འདུག་རཱ། ཁྱོད་རང་ལ།  ,dri ba dri dgos ma red bsam gi 'dug rA/_khyod rang la/__,https://d38pmlk0v88drf.cloudfront.net/wav16k/STT_NS_M0421_0105_1502691_to_1504909.wav,STT_NS,3,49,2.218,wav16k/STT_NS_M0421_0105_1502691_to_1504909.wav,དྲི་བ་འདྲི་དགོས་མ་རེད་བསམ་གི་འདུག་རཱ། ཁྱོད་རང་ལ།
STT_TT00766_0484_2883451_to_2887035,རྒྱལ་སྲས་ཞི་བ་ལྷ་གི་ཕྱག་སྲོལ་རེད་ཟེར་གོ་རེད། འདིའི་བརྒྱུད་པ་ནང་ལ་ཡོད་མ་རེད་ཞི་བ་ལྷ་དེ།  ,rgyal sras zhi ba lha gi phyag srol red zer go red/_'di'i brgyud pa nang la yod ma red zhi ba lha de/__,https://d38pmlk0v88drf.cloudfront.net/wav16k/STT_TT00766_0484_2883451_to_2887035.wav,STT_TT,3,88,3.584,wav16k/STT_TT00766_0484_2883451_to_2887035.wav,རྒྱལ་སྲས་ཞི་བ་ལྷ་གི་ཕྱག་སྲོལ་རེད་ཟེར་གོ་རེད། འདིའ་བརྒྱུད་པ་ནང་ལ་ཡོད་མ་རེད། ཞི་བ་ལྷ་དེ།
STT_MV0912_0248_1723092_to_1724944,ལིས་བྷའོ་ཧྲན།  ,lis b+ha'o hran/__,https://d38pmlk0v88drf.cloudfront.net/wav16k/STT_MV0912_0248_1723092_to_1724944.wav,STT_MV,3,15,1.852,wav16k/STT_MV0912_0248_1723092_to_1724944.wav,ལིས་བྷའོ་ཧྲན།
STT_TT00751_0235_1337573_to_1339909,སྣ་ཚོགས་སྤྲུལ་སྐུ་ཟེར་ནས་མིང་བཏགས་ཀི་ཡོད་རེད་དེ། མདོར་ན།  ,sna tshogs sprul sku zer nas ming btags ki yod red de/_mdor na/__,https://d38pmlk0v88drf.cloudfront.net/wav16k/STT_TT00751_0235_1337573_to_1339909.wav,STT_TT,3,58,2.336,wav16k/STT_TT00751_0235_1337573_to_1339909.wav,སྣ་ཚོགས་སྤྲུལ་སྐུ་ཟེར་ནས་མིང་བཏགས་ཀི་ཡོད་རེད་དེ། མདོར་ན།
STT_TT00766_0095_572534_to_578575,གང་ལྟར་ཨུམ་དེ་ནས་ཨུ། ཆོ་ག་དེ་རྣམས་ལ་བརྟེན་ནས། སྨོན་འཇུག་གི་སེམས། སྨོན་འཇུག་གི་སེམས་བསྐྱེད་ཐོབ་ནས་ཟེ།  ,gang ltar um de nas u/_cho ga de rnams la brten nas/_smon 'jug gi sems/_smon 'jug gi sems bskyed thob nas ze/__,https://d38pmlk0v88drf.cloudfront.net/wav16k/STT_TT00766_0095_572534_to_578575.wav,STT_TT,3,102,6.041,wav16k/STT_TT00766_0095_572534_to_578575.wav,གང་ལྟར་ དེ་ནས། ཆོ་ག་དེ་རྣམས་ལ་བརྟེན་ནས་ སྨོན་འཇུག་གིསེ། སྨོན་འཇུག་གི་སེམས་བསྐྱེད་ཐོབ་ནས་ཟེ།
STT_PC0135_0042_266762_to_272860,ནང་ལོགས་ལ་ཨ་ཁོ་ནང་ཚོས་ཨིམ་བུ་གུ་ཟ་འདི་ཨ་ཕ་མ་རང་ཉིད་ཀིས་གསོ་སྐྱོང་གནང་ ,nang logs la a kho nang tshos im bu gu za 'di a pha ma rang nyid kis gso skyong gnang _,https://d38pmlk0v88drf.cloudfront.net/wav16k/STT_PC0135_0042_266762_to_272860.wav,STT_PC,3,70,6.098,wav16k/STT_PC0135_0042_266762_to_272860.wav,ནང་ལོགས་ལ་ཨ་ཁོ་རྣམ་ཚོས་ཨུམ་བུ་གུ་ཟེར་ཡ་དེ། ཨ་ཕ་མ་རང་ཉིད་ཀིས་གསོ་སྐྱོང་གནང་།
STT_TT00761_1384_8683660_to_8687960,ད་ཡིན་ན་ཡང་། གཞན། གཞན་སྟོང་ནས་བཤད་དགོས་དུས་སྒང་ལ། གལ་ཆེ་ཤོས་གཅིག ,da yin na yang /_gzhan/_gzhan stong nas bshad dgos dus sgang la/_gal che shos gcig_,https://d38pmlk0v88drf.cloudfront.net/wav16k/STT_TT00761_1384_8683660_to_8687960.wav,STT_TT,3,65,4.3,wav16k/STT_TT00761_1384_8683660_to_8687960.wav,ད་ཡིན་ན་ཡང། གཞན་སྟོང་ནས་བཤད་འགྲོ་དུས་སྒང་ལ། གལ་ཆེ་ཤོས་ཅིག
STT_TT00763_0598_3361766_to_3371493,རྒྱུན་བཤགས་ནང་ལ་ཐུན་མོང་མ་ཡིན་པའི་སྐྱབས་འགྲོ་རྗེས་ཟློས་བྱེད་གོ་རེད། དེ་ཁ་སང་ང་ཚོའི་ད་ལྟ་འདི། དབུ་མ་སྤྱི། སྡོམ་གསུམ་སྤྱི་དོན་ལ་ཕྱིན་སོང་ང་། བྱས་ཙང་། ཀྱེ་རྡོ་རྗེའི་དབང་གི་སྟ་གོན་གྱི་ ,rgyun bshags nang la thun mong ma yin pa'i skyabs 'gro rjes zlos byed go red/_de kha sang nga tsho'i da lta 'di/_dbu ma spyi/_sdom gsum spyi don la phyin song nga /_byas tsang /_kye rdo rje'i dbang gi sta gon gyi _,https://d38pmlk0v88drf.cloudfront.net/wav16k/STT_TT00763_0598_3361766_to_3371493.wav,STT_TT,3,181,9.727,wav16k/STT_TT00763_0598_3361766_to_3371493.wav,རྒྱུན་བཤགས་ནང་ལ་ཐུན་མོང་མ་ཡིན་པའི་སྐྱབས་འགྲོ་རྗེས་ཟློས་བྱེད་ཀི་ཡོ་རེད། ད་ཁ་སང་ང་ཚོ་ད་ལྟ་དེ། དབུ་མ་སྤྱི། སྡོམ་གསུམ་སྤྱི་དོན་ལ་ཕྱིན་སོང་། བྱས་ཙང་། ཀྱེ་རྡོ་རྗེའི་དབང་གི་སྟ་གོན་གྱི་
STT_MV0912_0250_1728687_to_1736940,ག་རེ་བྱེད་ཀི་ཡོད། ག་རེ་བྱེད་ཀི་ཡོད། སྐད་བརྒྱབ་ཡ་ག་རེ་འདུག ག་རེ་བྱེད་ཀི་ཡིན། སྐད་ཆ་ཡོད་ན་ཡག་པོ་བྱས་ཤོད། ག་རེ་བྱེད་ཀི་ཡོད་ཨེ།  ,ga re byed ki yod/_ga re byed ki yod/_skad brgyab ya ga re 'dug_ga re byed ki yin/_skad cha yod na yag po byas shod/_ga re byed ki yod e/__,https://d38pmlk0v88drf.cloudfront.net/wav16k/STT_MV0912_0250_1728687_to_1736940.wav,STT_MV,3,125,8.253,wav16k/STT_MV0912_0250_1728687_to_1736940.wav,ག་རེ་བྱེད་ཀི་ཡོད། ག་རེ་བྱེད་ཀི་ཡོད། སྐད་བརྒྱབ་ཡ་ག་རེ་འདུག ག་རེ་བྱེད་ཀི་ཡོད། སྐད་ཆ་ཡོད་ན་ཡག་པོ་བྱས་ཤོད། ག་རེ་བྱེད་ཀི་ཡོད་ཨེ།
STT_PC0090_0018_133415_to_135559,བཀའ་རྒྱ་བཏང་པ་དང་། ལམ་སང་ལག་ལེན་བསྟར་ཐུབ་ཡ་ཡོད་མ་རེད།  ,bka' rgya btang pa dang /_lam sang lag len bstar thub ya yod ma red/__,https://d38pmlk0v88drf.cloudfront.net/wav16k/STT_PC0090_0018_133415_to_135559.wav,STT_PC,3,55,2.144,wav16k/STT_PC0090_0018_133415_to_135559.wav,བཀའ་རྒྱ་བཏང་པ་དང་ལམ་སང་ལག་ལེན་བསྟར་ཐུབ་ཡ་ཡོད་མ་རེད།
STT_TT00764_0462_2689326_to_2692494,རྣམ་གཞག་གཉིས་ཡོད་པ་གོང་དུ་བཤད་ཟིན་པ། རྒྱུ་མཚན་དེས་ན།  ,rnam gzhag gnyis yod pa gong du bshad zin pa/_rgyu mtshan des na/__,https://d38pmlk0v88drf.cloudfront.net/wav16k/STT_TT00764_0462_2689326_to_2692494.wav,STT_TT,3,54,3.168,wav16k/STT_TT00764_0462_2689326_to_2692494.wav,རྣམ་གཞག་གཉིས་ཡོད་པ་གོང་དུ་བཤད་ཟིན་པ་རྒྱུ་མཚན་དེས་ན།
STT_TT00765_0243_1501267_to_1505523,རང་དོན་དུ་དམན་པའི་བྱང་ཆུབ་ལ་དམིགས་ཏེ། གཞན་གནོད་གཞི་བཅས་སྤོང་བའི་སེམས་བྱུང་།  ,rang don du dman pa'i byang chub la dmigs te/_gzhan gnod gzhi bcas spong ba'i sems byung /__,https://d38pmlk0v88drf.cloudfront.net/wav16k/STT_TT00765_0243_1501267_to_1505523.wav,STT_TT,3,77,4.256,wav16k/STT_TT00765_0243_1501267_to_1505523.wav,རང་དོན་དུ་དམན་པའི་བྱང་ཆུབ་ལ་དམིགས་ཏེ། གཞན་གནོད་གཞི་བཅས་སྤོང་བའི་སེམས་བྱུང་།
STT_AB00265_0043_293984_to_302915,སྒྲོལ་མས། མགོ་ཪས་ཤིག་གྱོན་པ་དང་། འགྱིག་དམ་དེ་པང་གདན་གྱིས་བཏུམས་ནས། སྒོར་འདོན་སྐབས། ས་སྲིབ་ཀྱི་དུས་ཚོད་ཡིན་ན་ཡང་། ཁ་བ་ཟམ་ཟིམ་ ,sgrol mas/_mgo Ras shig gyon pa dang /_'gyig dam de pang gdan gyis btums nas/_sgor 'don skabs/_sa srib kyi dus tshod yin na yang /_kha ba zam zim _,https://d38pmlk0v88drf.cloudfront.net/wav16k/STT_AB00265_0043_293984_to_302915.wav,STT_AB,3,125,8.931,wav16k/STT_AB00265_0043_293984_to_302915.wav,སྒྲོལ་མས་མགོ་རས་ཤིག་གྱོན་པ་དང་འགྱིག་དམ་དེ་དཔལ་གདན་གྱིས་བཏུམས་ནས་སྒོ་དོན་སྐབས་ ས་སིབ་ཀྱི་དུས་ཚོད་ཡིན་ན་ཡང་ཁ་བ་ཟམ་ཟིམ་
STT_MV0944_0233_1737734_to_1747148,གོང་མ་མཆོག་ད་ལྟ་སུང་ལིས་ཚང་འགོ་དཔོན་ཅང་ཏུང་ལ་བསྡད་ཡོད་ནས། ལིས་ཤོས་ཉིད་དང་སུང་ཧྲི་ཏའོ་བསད་པ་ཆགས་བཞག་ན། གནས་ཚུལ་ཐག་གཅོད་ཐུབ་ཀི་མ་རེད། དེ་ལས་གནས་སྐབས་གཡུག་བཞག་བྱས།  ,gong ma mchog da lta sung lis tshang 'go dpon cang tung la bsdad yod nas/_lis shos nyid dang sung hri ta'o bsad pa chags bzhag na/_gnas tshul thag gcod thub ki ma red/_de las gnas skabs g.yug bzhag byas/__,https://d38pmlk0v88drf.cloudfront.net/wav16k/STT_MV0944_0233_1737734_to_1747148.wav,STT_MV,3,162,9.414,wav16k/STT_MV0944_0233_1737734_to_1747148.wav,གོང་མ་མཆོག ད་ལྟ་སུང་ལིས་ཚང་གི་འགོ་དཔོན། ཅང་ཏུང་ལ་བསྡད་ཡོད་ནས། ལིས་ཤོས་ཉིས་དང་སུང་ཧྲི་ཐའོ་བསད་པར་ཆ་བཞག་ནས་ གནས་ཚུལ་ཐག་གཅོད་ཐུབ་ཀི་མ་རེད། དེ་ལས་གནས་སྐབས་གཡུགས་བཞག་བྱས།
STT_NS_M0482_0225_1559776_to_1563189,མ་བཀྲུས་རྔུལ་ནག་དོན་འདྲ་བོ་བྱེད་བསྡད་ན་གཟུགས་པོ་ནས་རྔུལ་ནག་དྲི་མ་ཁ་གི་འདུག་བ།  ,ma bkrus rngul nag don 'dra bo byed bsdad na gzugs po nas rngul nag dri ma kha gi 'dug ba/__,https://d38pmlk0v88drf.cloudfront.net/wav16k/STT_NS_M0482_0225_1559776_to_1563189.wav,STT_NS,3,79,3.413,wav16k/STT_NS_M0482_0225_1559776_to_1563189.wav,མ་བཀྲུས་རྔུལ་ནག་དོན་འདྲ་བོ་བྱེད་བསྡད་ན་གཟུགས་པོ་ནས་རྔུལ་ནག་དྲི་མ་ཁ་གི་འདུག་བ།
STT_NS_M0450_0179_1267807_to_1269889,ང་ཚོས་དབྱིན་སྐད་ཐོག་ལབ་ན་ད་ཆའེ་ཁྀ་བྱེད་ཀི་རེད་ང་ཚོ།  ,nga tshos dbyin skad thog lab na da cha'e kh-i byed ki red nga tsho/__,https://d38pmlk0v88drf.cloudfront.net/wav16k/STT_NS_M0450_0179_1267807_to_1269889.wav,STT_NS,3,53,2.082,wav16k/STT_NS_M0450_0179_1267807_to_1269889.wav,ང་ཚོ་དབྱིན་སྐད་ཐོག་རྗེ་ལབ་ན། ད་ཆཱེཁྀ་བྱེད་ཀི་རེད་ང་ཚོ།
STT_NS_M0453_0291_1629024_to_1631049,ད་ལྟ་གཤིན་རྗེ་ཆོས་རྒྱལ་དང་དེ་འདྲའི་མཉམ་དུ།  ,da lta gshin rje chos rgyal dang de 'dra'i mnyam du/__,https://d38pmlk0v88drf.cloudfront.net/wav16k/STT_NS_M0453_0291_1629024_to_1631049.wav,STT_NS,3,44,2.025,wav16k/STT_NS_M0453_0291_1629024_to_1631049.wav,ད་ལྟ་གཤིན་རྗེ་ཆོས་རྒྱལ་དང་དེ་འདྲའི་མཉམ་དུ།
STT_NS_M0482_0226_1563689_to_1565941,ཨེ་ནས་ཨོ་དེ་ཡང་གཅིག་ད་གྱོང་རག་གི་ཡོད་རེད་བསམ་གི་འདུག་རཱ།  ,e nas o de yang gcig da gyong rag gi yod red bsam gi 'dug rA/__,https://d38pmlk0v88drf.cloudfront.net/wav16k/STT_NS_M0482_0226_1563689_to_1565941.wav,STT_NS,3,58,2.252,wav16k/STT_NS_M0482_0226_1563689_to_1565941.wav,ཨེ་ནས་ཨོ་དེ་ཡང་གཅིག་ད་གྱོང་རག་གི་རེད་བསམ་གི་འདུག་རཱ།
STT_MV0758_0040_254149_to_257162,ངས་ང་རའི་བརྩེ་གདུང་ལ་ཡང་བསྐྱར་ལྟ་སྟངས་གཅིག་འཛིན་དགོས་ཀིས་ལ།  ,ngas nga ra'i brtse gdung la yang bskyar lta stangs gcig 'dzin dgos kis la/__,https://d38pmlk0v88drf.cloudfront.net/wav16k/STT_MV0758_0040_254149_to_257162.wav,STT_MV,3,61,3.013,wav16k/STT_MV0758_0040_254149_to_257162.wav,ངས་ང་རའི་བརྩེ་དུང་ལ་ཡང་བསྐྱར་ལྟ་སྟངས་ཤིག་འཛིན་དགོས་ཀིས་ལ།
STT_NS_M0482_0227_1569274_to_1572431,ཡང་བསྐྱར་ད་གོམས་གཤིས་ཆུང་ཆུང་གཅིག་ག་རེ་རེད་ལབ་ན་ང་རང་ཚོ་གིས་ད།  ,yang bskyar da goms gshis chung chung gcig ga re red lab na nga rang tsho gis da/__,https://d38pmlk0v88drf.cloudfront.net/wav16k/STT_NS_M0482_0227_1569274_to_1572431.wav,STT_NS,3,64,3.157,wav16k/STT_NS_M0482_0227_1569274_to_1572431.wav,ཡང་བསྐྱར་ད་གོམས་གཤིས་ཆུང་ཆུང་གཅིག་ག་རེད་ལབ་ན་ང་རང་ཚོ་གིས་ད།
STT_PC0090_0025_170663_to_172711,ཡང་ཁྲིམས་ཁང་གཅིག་གིས་ཡིན་ན་མངའ་སྡེ་དེས་དེ་འདྲ་བྱེད་ཡ་གི་ ,yang khrims khang gcig gis yin na mnga' sde des de 'dra byed ya gi _,https://d38pmlk0v88drf.cloudfront.net/wav16k/STT_PC0090_0025_170663_to_172711.wav,STT_PC,3,57,2.048,wav16k/STT_PC0090_0025_170663_to_172711.wav,ཡང་ཁྲིམས་ཁང་གཅིག་གིས་ཡིན་ན། མངའ་སྡེ་དེ་དེ་འདྲས་བྱེད་ཡ་གི་
STT_TT00742_0045_243061_to_251989,ཅིག་རང་ཉིད་གཅིག་པུ་ཚེ་ཡི་བར་ཆད་སེལ་བ་མ་ཡིན་པ། མཁའ་ཁྱབ་ཀི་སེམས་ཅན་ཐམས་ཅད་ཟེར་ཡ་དེ། དམིགས་པ་དང་རྣམ་པ་རྒྱ་ཆེན་པོ་དེ་དགོས་ཀི་ཡོད་རེད་གསུངས་བ་རེད། དམིགས་རྣམ་རྒྱ་ཆེན་པོ་དེ་མེད་པ་ཡིན་ན།  ,cig rang nyid gcig pu tshe yi bar chad sel ba ma yin pa/_mkha' khyab ki sems can thams cad zer ya de/_dmigs pa dang rnam pa rgya chen po de dgos ki yod red gsungs ba red/_dmigs rnam rgya chen po de med pa yin na/__,https://d38pmlk0v88drf.cloudfront.net/wav16k/STT_TT00742_0045_243061_to_251989.wav,STT_TT,3,180,8.928,wav16k/STT_TT00742_0045_243061_to_251989.wav,ཅིག་རང་ཉིད་གཅིག་པུ་ཚེ་ཡི་བར་ཆད་སལ་བ་མ་ཡིན་པ། མཁའ་ཁྱབ་ཀི་སེམས་ཅན་ཐམས་ཅད་ཟེར་ཡ་དེ། དམིགས་པ་དང་རྣམ་པ་རྒྱ་ཆེན་པོ་དེ་དགོས་ཀི་ཡོད་རེད་གསུངས་བ་རེད། དམིགས་རྣམ་རྒྱ་ཆེན་པོ་དེ་མེད་པ་ཡིན་ན།
STT_TT00760_0727_4521527_to_4529018,དེ་ནས་རྟག་ཆད་ཀི་མཐའ་གཉིས་ཀ་ཡོད་པས་ཁྱབ་པ་རེད། བུམ་པ་བདེན་གྲུབ་དུ་ཁས་བླངས་སོང་ན། དཔེར་ན་དེ་རེད་བ། གཟུགས་བདེན་གྲུབ་དུ་ཁས་བླངས་སོང་ན།  ,de nas rtag chad ki mtha' gnyis ka yod pas khyab pa red/_bum pa bden grub du khas blangs song na/_dper na de red ba/_gzugs bden grub du khas blangs song na/__,https://d38pmlk0v88drf.cloudfront.net/wav16k/STT_TT00760_0727_4521527_to_4529018.wav,STT_TT,3,131,7.491,wav16k/STT_TT00760_0727_4521527_to_4529018.wav,དེ་ནས་རྟག་ཆད་ཀི་མཐའ་གཉིས་ཀར་ཡོད་པས་ཁྱབ་པ་རེད། བུམ་པ་བདེན་གྲུབ་ཏུ་ཁས་བླངས་སོང་ན། དཔེར་ན་དེ་རེད་བ། གཟུགས་བདེན་གྲུབ་ཏུ་ཁས་བླངས་སོང་ན།
STT_NS_M0453_0331_1843109_to_1845176,སྒོ་ང་ང་ཚོ་ནམ་རྒྱུན་རྡོག་བཙོས་རྒྱབ་ཀྱི་ཡོད་བ།  ,sgo nga nga tsho nam rgyun rdog btsos rgyab kyi yod ba/__,https://d38pmlk0v88drf.cloudfront.net/wav16k/STT_NS_M0453_0331_1843109_to_1845176.wav,STT_NS,3,47,2.067,wav16k/STT_NS_M0453_0331_1843109_to_1845176.wav,སྒོ་ང་ཨེ་འདྲའི་མང་པོ་རྡོག་རྩོག་སྐྱེས་གི་ཡོད་བ།
STT_MV0912_0251_1736940_to_1742836,ག་རེ་བྱེད་ཀི་ཡོད་མེད་ཁྱོད་རའི་སེམས་ནང་གསལ་པོ་ཤེས་ཀི་རེད། ཟམ་པའི་འོག་ལ་འདི་བཞག་མྱི་ཁྱོད་ར་ཡིན་པེ།  ,ga re byed ki yod med khyod ra'i sems nang gsal po shes ki red/_zam pa'i 'og la 'di bzhag myi khyod ra yin pe/__,https://d38pmlk0v88drf.cloudfront.net/wav16k/STT_MV0912_0251_1736940_to_1742836.wav,STT_MV,3,98,5.896,wav16k/STT_MV0912_0251_1736940_to_1742836.wav,ག་རེ་བྱེད་ཀི་ཡོད་མེད་ཁྱེད་རའི་སེམས་ནང་གསལ་པོ་ཤེས་ཀི་རེད། ཟམ་པའི་འོག་ལ་འདི་བཞག་མྱི་ཁྱོད་རས་ཡིན་པེ།
STT_TT00764_0487_2835009_to_2838081,ག་རེ་ཟེར་ན། སོ་སོར་ཐར་པའི་སྡོམ་པ་ལ་ངེས་འབྱུང་གི་བསམ་བློ་ཡོད་རེད།  ,ga re zer na/_so sor thar pa'i sdom pa la nges 'byung gi bsam blo yod red/__,https://d38pmlk0v88drf.cloudfront.net/wav16k/STT_TT00764_0487_2835009_to_2838081.wav,STT_TT,3,66,3.072,wav16k/STT_TT00764_0487_2835009_to_2838081.wav,ག་རེ་ཟེར་ན། སོ་སོར་ཐར་པའི་སྡོམ་པ་ལ། ངེས་འབྱུང་གི་བསམ་བློ་ཡོད་རེད།
STT_PC0135_0050_322965_to_330581,སུ་དང་སུ་ཡིན་ནས་ལས་བུ་གུ་སོ་སོས་ལྟ་མྱི་བྲོ་གི་རེད་བ། ད་ཡིན་ནས་ལས་ཀ་ག་འདྲས་བྱེད་དགོས་རེད། ལས་ཀར་མ་ཕྱིན་པ་ཡིན་ན་ཨེ་ནས་ཁྱིམ་ཚང་གི་ཡོང་བབས་ག་འདྲས།  ,su dang su yin nas las bu gu so sos lta myi bro gi red ba/_da yin nas las ka ga 'dras byed dgos red/_las kar ma phyin pa yin na e nas khyim tshang gi yong babs ga 'dras/__,https://d38pmlk0v88drf.cloudfront.net/wav16k/STT_PC0135_0050_322965_to_330581.wav,STT_PC,3,144,7.616,wav16k/STT_PC0135_0050_322965_to_330581.wav,སུ་དང་སུ་ཡིན་ནས་ལས། ཨ་བུ་གུ་སོ་སོས་ལྟ་སྙིང་བྲོ་གི་རེད་བ། ད་ཡིན་ནས་ལས་ཀ་ག་འདྲས་བྱེད་དགོས་རེད། ལས་ཀ་མ་ཕྱིན་པ་ཡིན་ན་ཨེ་ནས་ཁྱིམ་ཚང་གི་ཡོང་འབབ་ག་འདྲས་བྱེ།
