file_name,uni,wylie,url,dept,grade,char_len,audio_len,path,inf
STT_MV0454_0087_523103_to_525583,ཨ་ཧ་འོས། རྨོ ,a ha 'os/_rmo_,https://d38pmlk0v88drf.cloudfront.net/wav16k/STT_MV0454_0087_523103_to_525583.wav,STT_MV,3,13,2.48,wav16k/STT_MV0454_0087_523103_to_525583.wav,ཨ་ཨ་འོ། རྨོ
STT_AB00264_0039_277909_to_288506,ཧྲུའུ་ཅི་ཡང་ཧ་ལམ་བཟི་ནས་ཡོད་པས། གདོང་པ་དམར་རྐྱང་ཆགས་པ་དང་། ཆང་ཕོར་ཚུར་ལེན་བཞིན། དེ་རང་ཞུས་ཆོག ཡིན་ནས་ད་ལྟ་བར་རང་གི་གནས་ཚུལ་ཐག་གཅོད་མ་ཐུབ་ཙང་ ,hru'u ci yang ha lam bzi nas yod pas/_gdong pa dmar rkyang chags pa dang /_chang phor tshur len bzhin/_de rang zhus chog_yin nas da lta bar rang gi gnas tshul thag gcod ma thub tsang _,https://d38pmlk0v88drf.cloudfront.net/wav16k/STT_AB00264_0039_277909_to_288506.wav,STT_AB,3,141,10.597,wav16k/STT_AB00264_0039_277909_to_288506.wav,ཧྲུའུ་ཅི་ཡང་ཧ་ལམ་བཟི་ནས་ཡོད་པས་གདོང་པ་དམར་རྐྱང་ཆགས་པ་དང་ཆང་ཕོར་ཚུར་ལེན་བཞིན་དེ་རང་ཞུས་ཆོག ཡིན་ནས་ད་ལྟ་བར་རང་གི་གནས་ཚུལ་ཐག་གཅོད་མ་ཐུབ་ཙང་
STT_NS_M0420_0103_1269689_to_1277154,ཉི་མ་ཉི་མ་ཡོད་བ་ཁོང་ཁྲོ་གི་ཚད་གཞི་དེ་ཉུང་རུ་ཉུང་རུ་བཏང་ན་ཨེ་ནས་དུས་ཚོད་གཅིག་ད་ཁྱོད་རང་གི་རྒྱུད་ལ་ཡོད་བ་བཟོད་སྒོམ་དེ།  ,nyi ma nyi ma yod ba khong khro gi tshad gzhi de nyung ru nyung ru btang na e nas dus tshod gcig da khyod rang gi rgyud la yod ba bzod sgom de/__,https://d38pmlk0v88drf.cloudfront.net/wav16k/STT_NS_M0420_0103_1269689_to_1277154.wav,STT_NS,3,118,7.465,wav16k/STT_NS_M0420_0103_1269689_to_1277154.wav,ཉི་མ་ཉི་མ་ཡོད་བ། ཁོང་ཁྲོ་གི་ཚད་གཞི་དེ་ཉུང་རུ་ཉུང་རུ་བཏང་ན་ཨེ་ནས་དུས་ཚོད་གཅིག་ད་ཁྱོད་རང་གི་རྒྱུད་ལ་ཡོད་བ་བཟོད་སྒོམ་དེ།
STT_PC0089_0027_224772_to_227556,བྱས་ཙང་དེ་གས་དེ་ཟས་སྤྱོད་དེ་གས་དེ་ཚུལ་བཞིན་དུ་མ་སྲུང་པ་བྱས་བྱས། ཨེ་ནས།  ,byas tsang de gas de zas spyod de gas de tshul bzhin du ma srung pa byas byas/_e nas/__,https://d38pmlk0v88drf.cloudfront.net/wav16k/STT_PC0089_0027_224772_to_227556.wav,STT_PC,3,72,2.784,wav16k/STT_PC0089_0027_224772_to_227556.wav,བྱས་ཙང་འདི་གས་འདི་ཟས་སྤྱོད་དེ་གས་དེ་ཚུལ་བཞིན་དུ་མ་གསུང་པ་བྱས་བྱས། ཨེ་ནས།
STT_TT00761_1718_10682653_to_10688626,སླར་བསྡུས་ཏེ་བག་ཡོད་པར་གདམས་པ་ཟེར་ནས། ས་བཅད་བཞི་ཡོང་གི་འདུག་བ། དེའི་ནང་ནས་ས་བཅད་དང་པོའི་ནང་ལ་དེ་ནས།  ,slar bsdus te bag yod par gdams pa zer nas/_sa bcad bzhi yong gi 'dug ba/_de'i nang nas sa bcad dang po'i nang la de nas/__,https://d38pmlk0v88drf.cloudfront.net/wav16k/STT_TT00761_1718_10682653_to_10688626.wav,STT_TT,3,101,5.973,wav16k/STT_TT00761_1718_10682653_to_10688626.wav,སླར་བསྡུས་ཏེ། བག་ཡོད་པར་གདམས་པ་ཟེར་ན། ས་བཅད་བཞི་ཡོང་གི་འདུག་བ། དེའི་ནང་ནས་ས་བཅད་དང་པོའི་ནང་ལ་དེ་ནས།
STT_AB00265_0032_202005_to_208848,ཨ་མར་དེ་ལྟར་བཤད་ཀྱང་ཕན་ཐོགས་ཀི་མེད་པས། ཅི་ཡང་མ་བཤད་པར་འགྲོ་རྩིས་བྱས། འཆི་མེད་དབང་མོ་བསྐྱར་དུ་ ,a mar de ltar bshad kyang phan thogs ki med pas/_ci yang ma bshad par 'gro rtsis byas/_'chi med dbang mo bskyar du _,https://d38pmlk0v88drf.cloudfront.net/wav16k/STT_AB00265_0032_202005_to_208848.wav,STT_AB,3,94,6.843,wav16k/STT_AB00265_0032_202005_to_208848.wav,ཨ་མར་དེ་ལྟར་བཤད་ཀྱང་ཕན་ཐོགས་ཀྱི་མེད་པས་ཅི་ཡང་མ་བཤད་པར་འགྲོ་རྩིས་བྱས། འཆི་མེད་དབང་མོ་བསྐྱར་དུ་
STT_TT00736_0314_1755806_to_1759646,རྣམ་རྟོག་ངོ་བོ་ཆོས་སྐུར་གསུངས་པ་བཞིན་ཟེ་ད། རྣམ་རྟོག་གི་ངོ་བོ་ཆོས་སྐུ་དེ།  ,rnam rtog ngo bo chos skur gsungs pa bzhin ze da/_rnam rtog gi ngo bo chos sku de/__,https://d38pmlk0v88drf.cloudfront.net/wav16k/STT_TT00736_0314_1755806_to_1759646.wav,STT_TT,3,74,3.84,wav16k/STT_TT00736_0314_1755806_to_1759646.wav,རྣམ་རྟོག་ངོ་བོ་ཆོས་སྐུར་གསུངས་པ་བཞིན་ཟེ། ད་རྣམ་རྟོག་གི་ངོ་བོ་ཆོས་སྐུ་དེ།
STT_MV0454_0095_567830_to_570546,རྨོ། རླུང་མ་བྱེད་ད་ཨུ་གོ ལྟོས་ད ,rmo/_rlung ma byed da u go_ltos da_,https://d38pmlk0v88drf.cloudfront.net/wav16k/STT_MV0454_0095_567830_to_570546.wav,STT_MV,3,32,2.716,wav16k/STT_MV0454_0095_567830_to_570546.wav,རྨོ་ རླུང་མ་བྱེད་ད་ཨུ་གོ ལྟོས་ད
STT_MV0454_0096_570546_to_572826,ད་བརྙན་འཕྲིན་ལས་ཁུངས་ནས་མི་དགོས་ཟེར་ན་ཨ ,da brnyan 'phrin las khungs nas mi dgos zer na a_,https://d38pmlk0v88drf.cloudfront.net/wav16k/STT_MV0454_0096_570546_to_572826.wav,STT_MV,3,40,2.28,wav16k/STT_MV0454_0096_570546_to_572826.wav,ད་བརྙན་འཕྲིན་ལས་ཁུངས་ནས་མི་དགོས་ཟེར་ན་ཨ།
STT_TT00768_0399_2365418_to_2368970,ཨེ་རྒྱུན་ཆགས། དཀོན་མཆོག་གསུམ་ལ་བདག་སྐྱབས། སྡིག་པ་ཐམས་ཅད་སོ་སོར། ལ་སོགས་པ།  ,e rgyun chags/_dkon mchog gsum la bdag skyabs/_sdig pa thams cad so sor/_la sogs pa/__,https://d38pmlk0v88drf.cloudfront.net/wav16k/STT_TT00768_0399_2365418_to_2368970.wav,STT_TT,3,75,3.552,wav16k/STT_TT00768_0399_2365418_to_2368970.wav,རྒྱུན་ཆགས་དཀོན་མཆོག་གསུམ་ལ་བདག་ྐྱད་སྡིག་པ་ཐམས་ཅད་སོ་སོར་ལ་སོགས་པ།
STT_MV0944_0215_1626396_to_1629708,བཙུན་མོ་ཁྱེད་རང་གིས་ཕྱི་ལོགས་ལ་གོམ་པ་གང་སྤོས་ན་གསད་རྐྱང་གྱིས་གསུང་གིས་ ,btsun mo khyed rang gis phyi logs la gom pa gang spos na gsad rkyang gyis gsung gis _,https://d38pmlk0v88drf.cloudfront.net/wav16k/STT_MV0944_0215_1626396_to_1629708.wav,STT_MV,3,71,3.312,wav16k/STT_MV0944_0215_1626396_to_1629708.wav,བཙུན་མོ་ཁྱེད་རང་གིས་ཕྱི་ལོགས་ལ་གོམ་པ་གང་སྤོས་ན་གསད་རྐྱང་གྱིས་གསུངས་ཀིས།
STT_PC0135_0023_147636_to_155972,ད་ལྷན་རྒྱས་ཀིས་གཅིག་བྱས་ན་ཨ་དེ་འདྲས་ཅིག་ཡོད་རེད། ཐུགས་སྣང་ནང་ལོགས་ལ་ཕྱི་རྒྱལ་གི་བུ་གུ་ཚོ་ཡིན་པ་ཡིན་ན་སྣང་བ་སྐྱིད་པོ་ཞེ་བོ་ཅིག་ད། ག་རེ་བྱེད་མྱི་བྲོ་ནས།  ,da lhan rgyas kis gcig byas na a de 'dras cig yod red/_thugs snang nang logs la phyi rgyal gi bu gu tsho yin pa yin na snang ba skyid po zhe bo cig da/_ga re byed myi bro nas/__,https://d38pmlk0v88drf.cloudfront.net/wav16k/STT_PC0135_0023_147636_to_155972.wav,STT_PC,3,152,8.336,wav16k/STT_PC0135_0023_147636_to_155972.wav,ད་ལྷན་རྒྱས་ཀིས་ཅིག་བྱས་ན་ཨ་དེ་འདྲས་ཅིག་ཡོད་རེད། ཐུགས་སྣང་ནང་ལོགས་ལ་ཕྱི་རྒྱལ་གི་བུ་གུ་ཚོ་ཡིན་པ་ཡིན་ན། སྣང་བ་སྐྱིད་པོ་ཞེ་བོ་ཅིག་དང་ག་རེ་བྱེད་མྱིང་བྲོ་ནས།
STT_TT00761_0195_1261561_to_1267705,བྱས་ཙང་དེ་རེད་མ་གཏོགས། ཨེ་ནས། ཡིད་ཆེས་དད་པ་མེད་པ་རྩ་ནས་མ་རེད། ཀུན་མཁྱེན་ལྷག་པར་དུ་སྔགས་སྐབས་སུ་ཀུན་མཁྱེན་གིས།  ,byas tsang de red ma gtogs/_e nas/_yid ches dad pa med pa rtsa nas ma red/_kun mkhyen lhag par du sngags skabs su kun mkhyen gis/__,https://d38pmlk0v88drf.cloudfront.net/wav16k/STT_TT00761_0195_1261561_to_1267705.wav,STT_TT,3,111,6.144,wav16k/STT_TT00761_0195_1261561_to_1267705.wav,བྱས་ཙང་དེ་རེད་མ་གཏོགས། ཨེ་ནས་ཡིད་ཆེས་དད་པ་མེད་པ་རྩ་ནས་མ་རེད། ཀུན་མཁྱེན་ལྷག་པར་དུ་སྔགས་སྐབས་སུ་ཀུན་མཁྱེན་གིས་
STT_MV0944_0218_1641944_to_1651943,བཙུན་མོ་ཤའོ་ལགས་ཀིས་གཏམ་བཟང་ག་རེ་ཁེར་འདུག ཧེ་ཧེ་ཧེ་ཧ་ཨ་ ,btsun mo sha'o lags kis gtam bzang ga re kher 'dug_he he he ha a _,https://d38pmlk0v88drf.cloudfront.net/wav16k/STT_MV0944_0218_1641944_to_1651943.wav,STT_MV,3,56,9.999,wav16k/STT_MV0944_0218_1641944_to_1651943.wav,བཙུན་མོ་ཤའོ་ལགས་ཀིས་གཏམ་བཟང་ག་རེ་ཁེར་འདུག ཧེན་ཧུ་ཧ ཧ།
STT_AB00265_0034_216680_to_226305,ཨ་ཕའི་རོ། ག་རེའི་ཞའོ་ཧུང་། མོའི་སྐྱེས་གཟའ་ག་རེ་རེད། ཞེས་རང་གི་ཚ་མོར་སྐད་ཆ་ཤོད་བཞིན། སླར་ཡང་མོའི་མིང་དེས་སུན་སྣང་ཞིག་སྟེར་བས་ ,a pha'i ro/_ga re'i zha'o hung /_mo'i skyes gza' ga re red/_zhes rang gi tsha mor skad cha shod bzhin/_slar yang mo'i ming des sun snang zhig ster bas _,https://d38pmlk0v88drf.cloudfront.net/wav16k/STT_AB00265_0034_216680_to_226305.wav,STT_AB,3,125,9.625,wav16k/STT_AB00265_0034_216680_to_226305.wav,ཨ་ཕའི་རོ། ག་རེའི་ཞའོ་ཧུང་། མོའི་སྐྱེས་ས་ག་རེ་རེད་ ཞེས་རང་གི་མཚ་མོར་སྐད་ཆ་ཤོད་བཞིན་སླར་ཡང་མོའི་མིང་དེས་སུན་སྣང་ཞིག་སྟེར་བས་
STT_MV0503_0129_1136488_to_1141171,ཁོ་རང་གཉིས་དེ་བཞིན་གཤེགས་པའི་ཞལ་སློབ་ཡིན་པའི་ངོས་ནས།  ,kho rang gnyis de bzhin gshegs pa'i zhal slob yin pa'i ngos nas/__,https://d38pmlk0v88drf.cloudfront.net/wav16k/STT_MV0503_0129_1136488_to_1141171.wav,STT_MV,3,54,4.683,wav16k/STT_MV0503_0129_1136488_to_1141171.wav,ཁོ་རང་གཉིས་དེ་བཞིན་གཤེགས་པའི་ཞལ་ལོང་ཡིན་པའི་ངོས་ནས།
STT_PC0134_0111_580444_to_582492,རྒྱུ་ག་ཚད་ཡོད་ན་མེད་ན་དངོས་གནས་སེམས་པ་དེ་ཚོ་སྐྱིད་པོ།  ,rgyu ga tshad yod na med na dngos gnas sems pa de tsho skyid po/__,https://d38pmlk0v88drf.cloudfront.net/wav16k/STT_PC0134_0111_580444_to_582492.wav,STT_PC,3,55,2.048,wav16k/STT_PC0134_0111_580444_to_582492.wav,རྒྱུ་ག་ཚོད་ཡོད་ན་མེད་ན་དངོས་གནས་སེམས་པ་དེ་ཚོ་སྐྱིད་པོ།
STT_PC0135_0024_155972_to_164308,བྱེད་ཡ་ཡོད་པའི་ཨ་སྣང་ཚུལ་ཨེ་འདྲས་ཅིག་ཡོད་སྲིད་ཀི་རེད། ཨུ་ད་འདི་ང་རྣམ་ཚོའི་བོད་པའི་གཏམ་དཔེ་ཡ་ག་རེ་ཡོད་རེད་ཟེར་ན། ཨུམ་ ,byed ya yod pa'i a snang tshul e 'dras cig yod srid ki red/_u da 'di nga rnam tsho'i bod pa'i gtam dpe ya ga re yod red zer na/_um _,https://d38pmlk0v88drf.cloudfront.net/wav16k/STT_PC0135_0024_155972_to_164308.wav,STT_PC,3,117,8.336,wav16k/STT_PC0135_0024_155972_to_164308.wav,བྱེད་ཡ་ཡོད་པའི་ཨ་སྣང་ཚུལ་ཨེ་འདྲས་ཅིག་ཡོད་སྲིད་ཀི་རེད། ཨུམ་ད་འདི་ང་རྣམ་ཚོའི་བོད་པའི་གཏམ་དཔེ་ཡ་ག་རེ་ཡོད་རེད་ཟེར་ན།ཨོམ།
STT_PC0023_0070_516345_to_520633,སྤྱི་ཡོངས་ཀི་ངོས་འཛིན་ཡོད་པའི་ཆོས་ཚོགས་དེ་རྒྱ་ནག་ནང་པའི་ཆོས་ཚོགས་རེད། རྒྱ་ནག་ནང་པའི་ཆོས་ཚོགས་གཙོ་བོར་གྱུར་པའི་ ,spyi yongs ki ngos 'dzin yod pa'i chos tshogs de rgya nag nang pa'i chos tshogs red/_rgya nag nang pa'i chos tshogs gtso bor gyur pa'i _,https://d38pmlk0v88drf.cloudfront.net/wav16k/STT_PC0023_0070_516345_to_520633.wav,STT_PC,3,111,4.288,wav16k/STT_PC0023_0070_516345_to_520633.wav,སྤྱི་ཡོངས་ཀིས་ངོས་འཛིན་ཡོད་པའི་ཆོས་ཚོགས་དེ་རྒྱ་ནག་ནང་པའི་ཆོས་ཚོགས་རེད། རྒྱ་ནག་ནང་པའི་ཆོས་ཚོགས་གཙོ་བོར་གྱུར་པའི་
STT_NS_M0448_0012_64530_to_67124,གཉིས་པ་དེ་ལ་ཏཱ་ལའི་བླ་མ། གསུམ་པ་དེ་ལ་ཧྦི་ཋི་སི།  ,gnyis pa de la tA la'i bla ma/_gsum pa de la h+bi Thi si/__,https://d38pmlk0v88drf.cloudfront.net/wav16k/STT_NS_M0448_0012_64530_to_67124.wav,STT_NS,3,49,2.594,wav16k/STT_NS_M0448_0012_64530_to_67124.wav,གཉིས་པ་དེ་ལབ་དང་། བླ་མ་གསུམ་པ་དེ་ལ་ཝི་ཌི་སི།
STT_AB00265_0036_229701_to_238421,དེ་ལྟར་འཁང་ར་བྱས་པ་དང་། དེ་ནས་ཡང་དབུགས་རིང་ཞིག་འབྱིན་བཞིན། སྒྲོལ་མ། མི་གཞན་དག་ལ་ཡ་ངོ་གདོང་མ་བསྟན་ན། རང་གི་དོན་དག་ག་བར་གྲུབ་ཀི་རེད།  ,de ltar 'khang ra byas pa dang /_de nas yang dbugs ring zhig 'byin bzhin/_sgrol ma/_mi gzhan dag la ya ngo gdong ma bstan na/_rang gi don dag ga bar grub ki red/__,https://d38pmlk0v88drf.cloudfront.net/wav16k/STT_AB00265_0036_229701_to_238421.wav,STT_AB,3,132,8.72,wav16k/STT_AB00265_0036_229701_to_238421.wav,དེ་ལྟར་འཁང་ར་བྱས་པ་དང་དེ་ནས་ཡང་དབུགས་རིང་ཞིག་སྦྱིན་ཞིང་། སྒྲོལ་མ། མི་གཞན་དག་ལ་ཡ་ངོ་གདོང་མ་བལྟས་ན་རང་གི་དོན་དག་ག་བར་སྒྲུབ་ཀྱི་རེད།
STT_NS_M0434_0080_531629_to_537653,ད་ལྟ་ང་ཚོ་མཐོ་སློབ་ལ་འགྲོ་དུས་ཙམ་པ་ལ་གལ་སྲིད་ད་སོ་སོ་ལ་པེ་ཤག་མེད་བ་འདྲ་བོ་ཅིག་ཡིན་ན། ང་ཚོ་རྟག་པར་ད་པ་ལགས་ཨ་མར་སློང་བསྡད་ཀི་མ་རཱ།  ,da lta nga tsho mtho slob la 'gro dus tsam pa la gal srid da so so la pe shag med ba 'dra bo cig yin na/_nga tsho rtag par da pa lags a mar slong bsdad ki ma rA/__,https://d38pmlk0v88drf.cloudfront.net/wav16k/STT_NS_M0434_0080_531629_to_537653.wav,STT_NS,3,130,6.024,wav16k/STT_NS_M0434_0080_531629_to_537653.wav,ད་ལྟ་ང་ཚོ་མཐོ་སློབ་ལ་འགྲོ་དུས་ཙམ་པ་ལ་གལ་སྲིད་ད་སོ་སོ་ལ་པེ་ཤག་མེད་བ་འདྲ་བོ་ཅིག་ཡིན་ན། ང་ཚོ་རྟག་པར་ད་པ་ལགས་ཨ་མ་སློང་བསྡད་ཀི་མ་རཱ།
STT_TT00766_0492_2951715_to_2954718,དེ་ནས་གནས་གསར་པ་ཀུན་དགའ་ལེགས་པའི་འབྱུང་གནས། ས་ཆེན་ཀུན་དགའ་ལེགས་འབྱུང་།  ,de nas gnas gsar pa kun dga' legs pa'i 'byung gnas/_sa chen kun dga' legs 'byung /__,https://d38pmlk0v88drf.cloudfront.net/wav16k/STT_TT00766_0492_2951715_to_2954718.wav,STT_TT,3,72,3.003,wav16k/STT_TT00766_0492_2951715_to_2954718.wav,དེ་ནས་གནས་ཚལ་བ་ཀུན་དགའ་ལེགས་པའི་འབྱུང་གནས། ས་ཆེན་ཀུན་དགའ་ལེགས་པ།
STT_PC0135_0025_164598_to_173182,འབྲོག་པས་མཐུད་བཟས་པ་མཐོང་། འབྲོག་པས་ལ་རྒྱ་པ་མ་མཐོང་ཟེར་ཡ་དེ་ནང་བཞིན་བྱས་བྱས། ལྷན་རྒྱས་ཚོས་གཟིགས་གནང་པ་དེ་ཨ་འབྲས་བུ་ཅིག་རེད་བ་ལགས། ཡིན།  ,'brog pas mthud bzas pa mthong /_'brog pas la rgya pa ma mthong zer ya de nang bzhin byas byas/_lhan rgyas tshos gzigs gnang pa de a 'bras bu cig red ba lags/_yin/__,https://d38pmlk0v88drf.cloudfront.net/wav16k/STT_PC0135_0025_164598_to_173182.wav,STT_PC,3,136,8.584,wav16k/STT_PC0135_0025_164598_to_173182.wav,འབྲོག་པས་མཐུད་བཟས་པ་མཐོང་། འབྲོག་པས་ལ་བརྒྱབ་པ་མ་མཐོང་ཟེར་ཡ་དེ་ནང་བཞིན་བྱས་བྱས། ལྷན་རྒྱས་ཚོས་གཟིགས་གནང་པ་དེ་འབྲས་བུ་གཅིག་རེད་པ་ལགས། ཡིན
STT_TT00724_0208_1226680_to_1231203,ཡོད་ནས་མ་རྙེད་པ་མ་རེད། དེ་འདྲ་ཡིན་དུས། དུས་གསུམ་གྱི་རྟོགས་པ་ད་བྲལ་བ་ཟེ་བྱས།  ,yod nas ma rnyed pa ma red/_de 'dra yin dus/_dus gsum gyi rtogs pa da bral ba ze byas/__,https://d38pmlk0v88drf.cloudfront.net/wav16k/STT_TT00724_0208_1226680_to_1231203.wav,STT_TT,3,77,4.523,wav16k/STT_TT00724_0208_1226680_to_1231203.wav,ཡོད་ནས་མ་རྙེད་པ་མ་རེད། དེ་འདྲ་ཡིན་དུས་ དུས་གསུམ་གྱི་རྟོག་པ་དང་བྲལ་བ་ཟེ་བྱས།
STT_AB00265_0038_251527_to_258754,ང་ཚོར་ཡ་སྐལ་ལ་ཡོད་དོགས་མེད་ཅེས་ལམ་སེང་ལན་བཏབ། ད་ཆ་ཁོ་ཚོའི་ཁྱིམ་དུ་ཕྲུ་གུ་གསུམ་གྱི་བཟའ་འབྲུ་ ,nga tshor ya skal la yod dogs med ces lam seng lan btab/_da cha kho tsho'i khyim du phru gu gsum gyi bza' 'bru _,https://d38pmlk0v88drf.cloudfront.net/wav16k/STT_AB00265_0038_251527_to_258754.wav,STT_AB,3,92,7.227,wav16k/STT_AB00265_0038_251527_to_258754.wav,ང་ཚོར་ཡ་སྐལ་ལ་ཡོད་མདོག་མེད་ཅེས་ལམ་སེང་ལན་བཏབ། ད་ཆ་ཁོ་ཚོའི་ཁྱིམ་དུ་ཕྲུ་གུ་གསུམ་གྱི་བཟའ་འབྲུ་
STT_PC0023_0067_495161_to_498489,སྐབས་དེ་དུས་དུས་འཁོར་དབང་ཆེན་རེད། སིདྷི་ནིས་གྲོང་ཁྱེར་ལ་དུས་འཁོར་དབང་ཆེན་གནང་པའི་སྐབས་ལ་ ,skabs de dus dus 'khor dbang chen red/_sid+hi nis grong khyer la dus 'khor dbang chen gnang pa'i skabs la _,https://d38pmlk0v88drf.cloudfront.net/wav16k/STT_PC0023_0067_495161_to_498489.wav,STT_PC,3,89,3.328,wav16k/STT_PC0023_0067_495161_to_498489.wav,སྐབས་དེ་དུས་དུས་འཁོར་དབང་ཆེན་རེད། སི་ནི་གྲོང་ཁྱེར་ལ་དུས་འཁོར་དབང་ཆེན་གནང་པའི་སྐབས་ལ་
STT_TT00724_0187_1080947_to_1083283,ལམ་འདི་འདྲའི་ཅིག་ལ་བརྟེན་ནས་ལྷག་པར་དུ།  ,lam 'di 'dra'i cig la brten nas lhag par du/__,https://d38pmlk0v88drf.cloudfront.net/wav16k/STT_TT00724_0187_1080947_to_1083283.wav,STT_TT,3,40,2.336,wav16k/STT_TT00724_0187_1080947_to_1083283.wav,ལམ་འདི་འདྲའི་ཅིག་ལ་བརྟེན་ནས། ལྷག་པར་དུ།
STT_PC0135_0027_181766_to_190349,ག་ཚོད་ར་ཞིག་སྤྲད་གནང་གི་ཡོད་མིན། ལྷག་དོན་དུ་ཕ་མ་ཚོས་ཨ་ཅིག་པུ་གུ་ཚོའི་དུས་ཚོད་ཐད་ལ་བློས་གཏང་གནང་ཡ་དེ་ཚོ་ལྷན་རྒྱས་ཚོས་ཅིག་མཁྱེན་པ་ཡིན།  ,ga tshod ra zhig sprad gnang gi yod min/_lhag don du pha ma tshos a cig pu gu tsho'i dus tshod thad la blos gtang gnang ya de tsho lhan rgyas tshos cig mkhyen pa yin/__,https://d38pmlk0v88drf.cloudfront.net/wav16k/STT_PC0135_0027_181766_to_190349.wav,STT_PC,3,134,8.583,wav16k/STT_PC0135_0027_181766_to_190349.wav,ག་ཚད་ར་ཅིག་སྤྲད་གནང་གི་ཡོད་མིན། ལྷག་དོན་དུ་ཕ་མ་ཚོས་ཨ་ཅིག་བུ་གུ་ཚོའི་དུས་ཚོད་ཐད་ལ་བློས་བཏང་གནང་ཡ་དེ་ཚོ་ལྷན་རྒྱས་ཚོས་ཅིག་མཁྱེན་པ་ཡིན།
STT_TT00724_0196_1112875_to_1115243,གློ་བུར་བ་ཡིན་པ་ཤེས་ན། ཕན་ཐོགས་ག་རེ་ཡོད་རེད་ཟེ་ན།  ,glo bur ba yin pa shes na/_phan thogs ga re yod red ze na/__,https://d38pmlk0v88drf.cloudfront.net/wav16k/STT_TT00724_0196_1112875_to_1115243.wav,STT_TT,3,51,2.368,wav16k/STT_TT00724_0196_1112875_to_1115243.wav,གློ་བུར་བ་ཡིན་པ་ཤེས་ན། ཕན་ཐོགས་ག་རེ་ཡོད་རེད་ཟེར་ན།
STT_AB00265_0039_258754_to_265981,ལེན་རྒྱུ་ཡོད་པས། བཟའ་འབྲུའི་ཐད་ཀྱི་དཀའ་ངལ་རིམ་བཞིན་ཆུང་དུ་སོང་ན་ཡང་། དངུལ་དང་གྱོན་རྒྱུའི་ཐད་སྔར་བཞིན་དཀའ་ངལ་ཡོད་མོད།  ,len rgyu yod pas/_bza' 'bru'i thad kyi dka' ngal rim bzhin chung du song na yang /_dngul dang gyon rgyu'i thad sngar bzhin dka' ngal yod mod/__,https://d38pmlk0v88drf.cloudfront.net/wav16k/STT_AB00265_0039_258754_to_265981.wav,STT_AB,3,118,7.227,wav16k/STT_AB00265_0039_258754_to_265981.wav,ལེན་རྒྱུ་ཡོད་པས་བཟའ་འབྲུའ་ཐད་ཀྱི་དཀའ་ངལ་རིམ་བཞིན་ཆུང་དུ་སོང་ན་ཡང་། དངུལ་དང་གྱོན་རྒྱུའི་ཐད་སྔར་བཞིན་དཀའ་ངལ་ཡོད་མོད།
STT_MV0944_0230_1716211_to_1721558,རྩ་མེད་བཟོ་དགོས་རེད། ད་ལྟ་ལིས་ཤོས་ཉིདདང་སུང་ཧྲི་ཏའོ་ ,rtsa med bzo dgos red/_da lta lis shos nyidadang sung hri ta'o _,https://d38pmlk0v88drf.cloudfront.net/wav16k/STT_MV0944_0230_1716211_to_1721558.wav,STT_MV,3,53,5.347,wav16k/STT_MV0944_0230_1716211_to_1721558.wav,རྩ་མེད་བཟོ་དགོས་རེད། ད་ལྟ་ལིས་ཤོད་ཉིན་དང་སུང་ཧྲི་ཏའོ་
